"paperid","minitrackid","minitrackname","minitrackdescription","track","conference","title","abstract"
"b745004d-0715-478d-8273-f22e94e26c25","8edfca59-ee39-4942-a250-d76cc295adbc","Agile and Lean: Organizations, Products and Development","  Agile $$$and Lean: Organizations, Products and Development    (within the Software Technology Track)  Proposed Mini-track for HICSS 2023  In	this	mini-track,	we	seek	research	papers	and	experience	reports	that	explore	agile	 practices,	lean	practices	or	an	integration	of	agile	and	lean	practices	(including	Scrum,	 Kanban,	Extreme	Programming/XP,	Lean	Startup,	Continuous	Development,	etc.).	We	also	 seek	to	explore	how	these	concepts	can	be	leveraged	in	other	contexts	(such	as	data	 science	or	engineering),	and	more	generally,	how	to	expand	the	use	of	agile	and	lean	 beyond	software	development.			 Further,	as	an	addition	for	2023,	we	seek	to	make	it	easier	for	practitioners	to	submit	an	 experience	report	by	offering	to	match	potential	experience	report	writers	with	someone	 who	has	previously	written	HICSS	papers,	and	so,	can	help	document	the	practitioners	 experience	within	the	standard	format	/	structure	of	a	HICSS	paper.	Practitioners	seeking	 this	support	should	reach	out	to	a	mini-track	co-chair	prior	to	submitting	an	experience	 report.	 Our mini-track seeks to answer questions such as:	 •  What	guidance	can	we	provide	to	product	leaders,	managers	and	developers	to	help	 motivate,	create	and	sustain	better	agile/lean	behaviors	and	more	profitable	 outcomes?		 •  How	can	we	incorporate	product	design,	architecture,	engineering,	risk	reduction,	 budgeting	and	offshoring	into	agile/lean	while	preserving	empiricism,	 experimentation	and	adaptation?		 •  How	can	agile	and	lean	can	be	integrated	within	a	single	coherent	approach?	 •  Which	metrics	help	enterprises,	teams	and	individuals	adapt	and	improve?	What	 common	behaviors	do	we	see	in	agile	or	lean	teams	and	how	do	those	behaviors	 affect	outcomes?		 •  How	do	organizations	and	cultures	restructure	to	support	these	philosophies	and	 when	they	do	not	restructure,	what	happens?		 •  How	do	organizations	implement,	monitor	and	improve	hiring,	coaching,	training	 and	mentoring?		 •  How	does	agile	scale	(such	as	coordination	between	agile	teams,	interfacing	 between	agile	principles	at	a	project	or	enterprise	level),	including	comparative	 results	on	the	use	of	different	agile	scaling	frameworks?	 •  How	can	agile	be	implemented	within	other	contexts	(e.g.,	data	science)?	 •  How	do	agile	and	lean	principles	extend	to	DevOps	environments?	Is	there	a	 difference	between	agile	and	lean	before	and	after	deployment?	How	are	post- deployment	issues	and	opportunities	in	software	projects	impacting	planning	and	 development	of	software	development	projects?	     Possible additional topics for the mini-track include but are not limited to:  •  Empirical	outcome	comparisons	in	industrial	settings:	agile	and	non-agile,	remote	 and	collocated,	impact	of	different	agile	or	lean	methods,	etc.	 •  New	frontiers	in	agile	or	lean	management	–	going	beyond	software	development	 •  Forecasting,	risk	reduction,	planning	 •  Exploring	the	fit	between	agile	(or	lean)	organizations	and	their	environmental	 context.	 •  Agile	and	lean	requirements	engineering,	dependency	management	and	risk	 management	 •  Conflict	in	agile	or	lean	organizations	and	their	development	teams:	what	cultures	 work	and	don’t	work?	 •  What	cultures	and	leadership	characteristics	lead	to	sustained	agility?	 •  Evolution	of	agile	or	lean	organizations	 •  Case	studies	on	agile	or	lean	management	and	experimentation,	in	atypical	 situations	 •  Impact	of	tool	use	on	agile	or	lean	management	 •  New	approaches	to	teaching	and	coaching	agile	or	lean	organizations	 •  Lessons	learned	in	agile	and	lean	management	 •  How	do	agile	and/or	lean	management	compare	with	traditional	management?	 	 	 Mini-track co-chairs  Jeffrey	S.	Saltz	(primary	contact)	 Associate	Professor	 Syracuse	University	 Email:	jsaltz@syr.edu	 	 Edward	G.	Anderson	 Professor	 McCombs	School	of	Business,	University	of	Texas		 Email:	Edward.Anderson@mccombs.utexas.edu	 		 Alex	Sutherland	 Entrepreneur	/	Scrum	Master	 Email:	alex.sutherland@scruminc.com	 	 All	co-chair	organizations	support	the	participation	of	the	co-chairs,	and	will	support	travel	 to	HICSS.	     Biographies  Dr.	Jeffrey	Saltz—Associate	Professor,	Syracuse	University	 Since	joining	Syracuse	University	in	2014,	Saltz’s	research	and	consulting	engagements	 concentrate	on	helping	organizations	leverage	data,	information	technology	and	analytics	 for	competitive	advantage,	specifically	focusing	on	how	to	effectively	manage	and	 coordinate	data	science	projects	within	and	across	teams.	His	publications,	in	outlets	such	 as	the	Journal	of	the	Association	for	Information	Science	and	Technology	and	Transactions	on	 Computing	Education,	cover	both	the	education	and	management	of	technology	teams.	In	 his	last	corporate	role,	at	JPMorgan	Chase,	he	reported	to	the	firm's	Chief	Information	 Officer	and	drove	technology	innovation	across	the	organization.		Saltz	received	his	B.S.	in	 computer	science	from	Cornell	University,	an	M.B.A.	from	The	Wharton	School	at	the	 University	of	Pennsylvania	and	a	Ph.D.	in	Information	Systems	from	the	NJIT.	 		 Dr.	Ed	Anderson,	Professor,	University	of	Texas	 Dr.	Edward	Anderson	is	the	Wright	Centennial	Professor	for	Managing	Innovative	 Technology	at	the	University	of	Texas	McCombs	School	of	Business.	He	received	his	 doctorate	from	the	Massachusetts	Institute	of	Technology	and	his	bachelor’s	degree	from	 Stanford	University.	His	research	interests	include	outsourced	product	development	 (distributed	innovation)	and	project	management,	healthcare	delivery,	knowledge	 management,	supply	chain	management,	and	computer	simulation.	He	has	published	 articles	in	Management	Science,	Production	and	Operations	Management,	Information	 Systems	Research,	Organization	Science,	and	The	System	Dynamics	Review.	He	is	a	co-author	 of	the	book	The	Innovation	Butterfly:	Managing	Emergent	Opportunities	and	Disruptions	 Under	Distributed	Innovation,	which	describes	leadership	metrics,	planning,	and	 organization	in	the	complex	adaptive	system	that	is	innovation	management.	He	is	also	co- author	of	Operations	Management	for	Dummies.	Dr.	Anderson	is	a	past	president	of	both	the	 Production	and	Operations	Management	Society	and	the	System	Dynamics	Society.	He	is	 the	department	editor	of	Production	and	Operations	Management	for	Industry	Studies	and	 Public	Policy.	He	won	the	prestigious	Wickham	Skinner	Early-Career	Research	Award	and	 has	received	research	grants	from	the	National	Science	Foundation,	the	U.S.	Veterans	 Administration,	SAP,	and	Hewlett-Packard.	Professor	Anderson	has	consulted	with	Ford,	 Shell,	Dell,	Hewlett-Packard,	Frito-Lay,	and	Atlantic-Richfield	and	holds	six	U.S.	and	 international	patents	from	his	work	at	the	Ford	Motor	Company.	 		 Alex	Sutherland,	Scrum	Inc.	 Alex	is	a	serial	entrepreneur	with	a	decade	of	experience	practicing	Scrum	both	as	a	 developer	and	as	a	product	owner.	He	first	learned	Scrum	in	2007	by	attending	one	of	 Scrum	Inc.’s	first	Scrum	Master	classes	and	has	used	it	since	to	envision,	create,	market,	 and	sell	software	products	to	customers	around	the	globe	across	multiple	industries.	Prior	 to	becoming	an	entrepreneur,	Alex	was	a	graduate	student	in	Game	Theory	at	Caltech	and	 released	the	first	commercial	Nash	Equilibrium	solver	for	Poker.	 	     Background  An	agile	approach	focuses	on	using	a	cycle	of	experimentation,	inspection	and	adaptation	to	 improve	production.	Agile	is	most	often	applied	to	software	development,	and	we	expect	 many	papers	in	this	mini-track	to	discuss	software	organizations	and	software	engineering	 practices.	However,	we	also	welcome	papers	that	describe	other	types	of	organizational	 “production”,	such	as	business	intelligence,	management	initiatives,	manufacturing,	 marketing,	sales	and	finance.	 A	lean	approach	focuses	rapid	experiments	by	trying	to	continually	reduce	waste	and	 minimizing	work-in-progress.	Lean	has	recently	been	popularized	as	a	construct	for	start- up	organizations	(“Lean	Startup”	or	“Lean	Entrepreneurship”).			Advocates	claim	a	lean	 approach	produces	greater	market	satisfaction	and	customer	engagement,	earlier	 discovery	of	hidden	market	opportunities,	higher	revenues	and	more	efficient	use	of	 development	staff.	 These	approaches	claim	superiority	in	new	product	development	over	traditional	 approaches	(such	as	“waterfall	management”)	that	fail	to	test	development	and	market	 assumptions	in	long-range	plans.	 Agile	and	lean	approaches	challenge	organizations	large	and	small.	People	typically	 conflate	small	failures	(learning)	with	large	failures	(organizational	threats),	assume	that	 innovation	means	taking	long-range	untested	risk,	and	establish	and	protect	budgets	with	 many	baked-in	production	and	market	assumptions.	These	cultural	realities	interfere	with	 agility	and	real	innovation.	 As	a	result,	companies	often	invest	enormous	amounts	of	money	in	incomplete	or	 abandoned	agile	transformations.	What	can	organizations	do	to	improve	agile	uptake?	How	 do	we	know	that	the	organization	is	improving?	How	can	organizations	diagnose	problems	 without	motivating	gaming?	What	types	of	people	are	more	likely	to	thrive	in	agile	and	lean	 organizations,	and	what	roles	should	they	take?	What	hiring	practices	result	in	better	 candidates?	What	training	programs	produce	better	results?	What	coaching	structures	 work?	How	do	we	measure	these	activities?	 Marketing Plan  •  Solicit	key	influencers	in	agile	and	lean	practices.	This	will	combine	mailing	lists	 from	the	mini-track	co-chairs,	who	are	active	in	the	Scrum,	agile	and	lean	academic	 and	professional	communities.	 •  Continue	a	practice	of	marketing	HICSS	as	a	place	where	“systems	thinkers”	get	 together,	from	a	variety	of	fields.	Attendees	and	speakers	will	benefit	from	exposure	 to	more	fields	(and	markets	for	their	research).	 •  Market	this	session	and	venue	as	a	place	where	the	agile/lean	academics	and	 professionals	can	meet,	discuss	and	collaborate	on	agile	and	lean	startup	 implementations	for	enterprises,	small	groups	and	individuals.	         ","ST","HICSS-56"," A model for DevOps adoption in Swiss SMEs ","DevOps is a new shift in business and information technology with the aim of closing the gap between development and operations. Current literature focuses mainly on the adoption of DevOps in large enterprises. Most of the resulting methods and frameworks are not suitable for smaller enterprises, which differ from large enterprises in many aspects. This paper examines small and medium enterprises and reports on research findings on how such enterprises have managed to successfully implement DevOps and for those who have not yet been able to implement it, how to overcome the challenges and obstacles they face during implementation. This is done by developing a methodology that describes the requirements needed for a successful DevOps implementation in SMEs. The proposed methodology has been tested in domestic Swiss SMEs with experts and internal IT development teams. We validated our findings and propose an adoption method, a checklist and a metamodel to facilitate the DevOps adoption process for SMEs looking to adopt DevOps. The results show that the developed method has practical implications and significantly simplifies the implementation process. However it needs to be adapted to the characteristics of the company before implementation.  "
"b88d3747-cc25-47b2-9725-da47f78348d7","ea224363-f88a-4c6a-b25d-c1a572a389b0","Esports","HICSS-56 Minitrack Proposal      Title of a minitrack: Esports      Track that a minitrack belongs: Internet and the digital economy      Description of a minitrack:    Esports research is a field with conflicting definitions and multiple perspectives. Despite the  differences between approaches to esports, all emphasize its technological specificity and  competitiveness. In the last decade, esport has ceased to be seen solely as entertainment for  the youth and has become the fastest-growing sports area. This view is supported by the  increase in the number of events organized, their popularity among millions of viewers, and  the growing number and professionalization of gamers. Traditional sports are still bigger than  the biggest esports, making more revenue or player salaries. However, esports is quickly  catching up, given the growing number of broadcasted games, tournament prize pools, and  increasing advertising potential of esports games. Despite the increasing popularity of esports,  the research is still in its nascency. After an initial descriptive stage, the focus shifts from  explaining what esports is to a more nuanced understanding of the phenomenon.     This minitrack aims to provide insight into esports’ theoretical development and practical  understanding without excluding any methodological approach or scientific disciplines.  Conceptual, theoretical, empirical, and methodological contributions that enrich our  understanding of esports are welcome.     Given the diverse goals of this minitrack, possible topics include, but are not limited to:    •  Business, e.g. discovering esports consumers’ motivations; designing effective  marketing tools; understanding players’/esports’ networks and organizations;  gamers/fans as consumers.  •  Cognitive Science/Psychology, e.g. studying factors influencing athletes’  performance; their abilities and skills; cognitive and behavioral differences between  athletes.   •  IT, e.g. using game telemetry, biometrics, user-generated data, or text mining to study  esports, e.g. team dynamics, interactions of players; in-game performance.  •  Law, e.g. copyright issues   •  Sociology, e.g. gamers’ and athletes’ interactions and identities; live events and  streaming dynamics; gender issues (gender gap).  •  Media Studies, e.g. relations between esports, traditional sports, and the media; offline  spaces versus live-streaming, understanding esports in terms of virtual versus real;  how technology mediates gaming, and how esports’ communities fit here.  •  Sports Science, e.g., comparing esports and ‘traditional’ sports; esports as ‘real’,  ‘genuine’ sports or new quality.           Journals for fast track opportunities, if any:      Journal of Electronic Gaming and Esports       Marketing plan:    •  Using research networks and various associations, e.g. Esports Research Network;  Association of Internet Researchers; National Communication Association;  International Communication Association, European Communication Research and  Education Association.  •  Esports research journals (e.g. JEGE), conferences and communities.  •  Grassroots activism in this area.      Name, affiliation, and contact information of minitrack chair (primary contact) and co- chair(s):    Piotr Siuda (Primary Contact)  Kazimierz Wielki University in Bydgoszcz  piotr.siuda@ukw.edu.pl    Maciej Behnke  Adam Mickiewicz University  macbeh@amu.edu.pl    David P. Hedlund  St. John’s University  hedlundd@stjohns.edu       Short bio-sketch of minitrack chair and co-chair(s):    Piotr Siuda (PhD) is a media studies scholar, Associate Professor at the Institute of Social  Communication and Media at the Kazimierz Wielki University in Bydgoszcz, Poland.  Member of The Association of Internet Researchers and the Polish Society for Social  Communication. His research includes esports athletes’ and fans’ communities.     Maciej Behnke (PhD) Doctor of psychology, co-director of the Social Psychophysiology Lab  at the Adam Mickiewicz University in Poznan. His research centers on the psychophysiology  of esports performance, especially on the role of (positive) emotions and emotion regulation.     David P. Hedlund (PhD) is an Associate Professor and the Director of the Institute of  Interdisciplinary Sport Research (IISR) at St. John’s University in Queens, New York, USA.  He is the founding Chief Editor of the Journal of Electronic Gaming and Esports and lead  author and editor of the book Esports Business Management. His research spans esports and  sports, with a focus on marketing, consumer behavior, management and analytical topics.       An explicit statement that your organization endorses your involvement:    UNIWERSYTET  KAZIMIERZA  WIELKIEGO  w  BYDGOSZCZY  Instytut Komunikacji Społecznej i Mediów                                            ul. K. Szymanowskiego 3, 85-074 Bydgoszcz, tel. 52 326 64 37      Piotr Siuda  Kazimierz Wielki University in Bydgoszcz, Poland    Address:  ul. K. Szymanowskiego 3,  85-074 Bydgoszcz, p. 1.38  Phone: +48 606 944 607        STATEMENT      Dear HICSS-56 Conference Organizers    I state that my organization – Kazimierz Wielki University in Bydgoszcz – endorses my  involvement and will pay for my travel expenses and registration fee to attend HICSS.    The costs will be covered from the funds granted by the Polish Ministry of Education  and Science.      Piotr Siuda         Łąą§ §Ł Ąłł § łłł§§łłłłł§§ Ł ń     Ę ę  ę  Ę        ę żż ę  ń  ","IN","HICSS-56","Electronic Arts Suspends Operations in Russia: Examining Twitter Reactions from the Echo Chamber's Perspective","With reference to the echo chamber concept contained within Moscovici's theory of group polarization, this research examines the Twitter user's attitude regarding Electronic Arts' decision to exclude Russia from participating in FIFIA 22 and also halt the sale of its product to Russia and Belarus. The current study employs an experimental research approach to scrape Twitter using the RStudio software, with the hashtag search term ""EA+Russia"".  The outcomes of the study suggest that consumers are inherently positive about the EA's choice and have a strong fear for Russia. The echoing of information from the tweets designated as ""favorites"" may, on the other hand, have the effect of altering the pre-existing user's mood and introducing a new emotion."
